{"schema":"dx-exfor-shard","schema_version":1,"reaction":{"key":"12C(a,g)","slug":"12C-a-g","target":"12C","projectile":"a","process":"g","compound":"16O","atlas":["12C-ag-16O"]},"entries":{"E2169":{"authors":["H.Makii","Y.Nagai","T.Shima","M.Segawa","K.Mishima","H.Ueda","M.Igashira","T.Ohsaki"],"first_author":"Makii","title":"E1 and E2 cross sections of the 12C(a,g0)16O reaction using pulsed alpha beam","refs":[{"code":"J,PR/C,80,(6),065802,200912","type":"J","journal":"Physical Review, Part C, Nuclear Physics","year":2009,"note":"Main reference. See also TITLE and AUTHOR."},{"code":"T,UEDA,200701","type":"T","year":2007,"note":"Data at Ecm=1.225 and 1.467 MeV"}],"doi":null,"institutes":[{"code":"2JPNOSA","name":"Osaka University , Osaka"},{"code":"2JPNTIT","name":"Institute of Science Tokyo, Tokyo"}],"facility":[{"code":"VDGT","name":"Tandem van de Graaff","institute":"2JPNTIT","text":"3.2-MV Pelletron"}],"methods":[],"detectors":["NAICR","SI"],"entry_date":"2010-05-14","entry_updated":"2010-06-10","entry_revisions":1,"year":2009,"entry_history":[{"date":"2009-12-23","code":"C","text":"Nf"}],"entry_status":[],"links":{"exfor":"https://nds.iaea.org/EXFOR/E2169","master":"https://github.com/IAEA-NDS/exfor_master/blob/d2af85eca4ce9b76529f096e7f9603da60654732/exforall/E21/E2169.x4"}}},"datasets":[{"meta":{"id":"E2169.002","entry":"E2169","subentry":"002","pointer":"","code":"6-C-12(A,G)8-O-16,PAR,DA","sf":[["6-C-12","A","G","8-O-16","PAR","DA","","",""]],"complex":false,"reaction":"12C(a,g)","target":"12C","projectile":"a","process":"g","product":"8-O-16","compound":"16O","quantity":"PAR,DA","quantity_class":"dsigma","quantity_text":"Partial differential cross section d/dA","E_frame":"cm","E_source":"EN-CM","ang_frame":"lab","value_frame":"lab","value_unit":"b/sr","cm_approx":false,"emin_cm":1.407,"emax_cm":1.591,"emin_lab":1.87639,"emax_lab":2.12179,"kt_min":null,"kt_max":null,"npts":6,"nexcluded":0,"final_levels":[0.0],"level_heading":"E-LVL","err_components":[{"name":"ERR-6","kind":"sys","where":"common","unit":"PER-CENT","relative":true,"value":2.0,"text":"Effective reaction energy"},{"name":"ERR-1","kind":"sys","where":"common","unit":"PER-CENT","relative":true,"value":3.0,"text":"gamma-ray detection efficiency"},{"name":"ERR-2","kind":"sys","where":"common","unit":"PER-CENT","relative":true,"value":3.0,"text":"Solid angle of Si detector"},{"name":"ERR-3","kind":"sys","where":"common","unit":"PER-CENT","relative":true,"value":1.4,"text":"Correction for Faraday cup"},{"name":"ERR-4","kind":"sys","where":"common","unit":"PER-CENT","relative":true,"value":1.0,"text":"Gain shift of Si detector"},{"name":"ERR-5","kind":"sys","where":"common","unit":"PER-CENT","relative":true,"value":1.0,"text":"Energy loss in carbon target"},{"name":"ERR-T","kind":"total","where":"point","unit":"NB/SR","relative":false,"text":"Total uncertainty"}],"d_tot_source":"ERR-T","err_columns":{"ERR-T":"d_tot"},"monitor":[],"flags":[],"flag_texts":{},"status":[{"code":"TABLE","ref":"","text":"Table VII of J,PR/C,80,065802,2009"}],"superseded_by":null,"history":[],"subentry_date":"2010-05-14","slices":["A"]},"points":{"E_lab":[1.87639,1.87639,1.87639,2.12179,2.12179,2.12179],"E_cm":[1.407,1.407,1.407,1.591,1.591,1.591],"dE":[0.003,0.003,0.003,0.003,0.003,0.003],"ang":[40.0,90.0,130.0,40.0,90.0,130.0],"E_level":[0.0,0.0,0.0,0.0,0.0,0.0],"value":[5.1e-11,3.64e-11,2.2e-11,1.06e-10,8.58e-11,3.74e-11],"d_sys":[2.598e-12,1.855e-12,1.121e-12,5.401e-12,4.372e-12,1.906e-12],"d_tot":[3.8e-12,3.3e-12,2.8e-12,6.6e-12,5.5e-12,3.9e-12]},"excluded":[]}]}