{"schema":"dx-exfor-shard","schema_version":1,"reaction":{"key":"3He(a,g)","slug":"3He-a-g","target":"3He","projectile":"a","process":"g","compound":"7Be","atlas":["3He-ag-7Be"]},"entries":{"O1709":{"authors":["H.Costantini","D.Bemmerer","F.Confortola","A.Formicola","Gy.Gyuerky","P.Bezzon","R.Bonetti","C.Broggini","P.Corvisiero","Z.Elekes","Zs.Fuelop","G.Gervino","A.Guglielmetti","C.Gustavino","G.Imbriani","M.Junker","M.Laubenstein","A.Lemut","B.Limata","V.Lozza","M.Marta","R.Menegazzo","P.Prati","V.Roca","C.Rolfs","C.Rossi Alvarez","E.Somorjai","O.Straniero","F.Strieder","F.Terrasi","H.P.Trautvetter"],"first_author":"Costantini","title":"The He-3(a,g)Be-7 S-factor at solar energies: The prompt gamma experiment at LUNA.","refs":[{"code":"J,NP/A,814,144,2008","type":"J","journal":"Nuclear Physics, Section A","year":2008,"note":"main reference"},{"code":"J,PR/C,75,035805,2007","type":"J","journal":"Physical Review, Part C, Nuclear Physics","year":2007,"note":"O1520 E(eff)=105.6 MeV. Activation method"},{"code":"J,PRL,97,122502,2006","type":"J","journal":"Physical Review Letters","year":2006,"note":"O1399 Cross section data at E=127-169-keV. Activation method."},{"code":"J,PR/C,75,065803,2007","type":"J","journal":"Physical Review, Part C, Nuclear Physics","year":2007,"note":"O1516"}],"doi":null,"institutes":[{"code":"2ITYGVA","name":"Universita degli Studi di Genova + INFN Genova"},{"code":"2GERDRE","name":"Technische Universitaet Dresden, Dresden and Pirna"},{"code":"2ITYLGS","name":"LINFN Laboratori Nazionali del Gran Sasso, Assergi"},{"code":"3HUNDEB","name":"Institute for Nuclear Research (ATOMKI), Debrecen"},{"code":"2ITYPAD","name":"INFN Laboratori Nazionali di Legnaro, Legnaro, Padova"},{"code":"2ITYMIL","name":"Universita degli Studi di Milano + INFN Milano"},{"code":"2ITYTUR","name":"Universita degli Studi di Torino + INFN Torino"},{"code":"2ITYNAP","name":"University degli Studi di Napoli Federico II + INFN Napoli"},{"code":"2GERBOC","name":"Ruhr-Universitaet Bochum"},{"code":"2ITYOAC","name":"Osservatorio Astronomico di Collurania, Teramo"},{"code":"2ITYFSN","name":"Universita degli Studi della Campania, Caserta"}],"facility":[{"code":"ACCEL","name":"Accelerator","institute":"2ITYLGS","text":"The 400 kV LUNA accelerator."}],"methods":["ACTIV"],"detectors":["SOLST","HPGE"],"entry_date":"2009-03-12","entry_updated":"2009-04-17","entry_revisions":1,"year":2008,"entry_history":[{"date":"2009-01-11","code":"C","text":"SB"}],"entry_status":[],"links":{"exfor":"https://nds.iaea.org/EXFOR/O1709","master":"https://github.com/IAEA-NDS/exfor_master/blob/d2af85eca4ce9b76529f096e7f9603da60654732/exforall/O17/O1709.x4"}}},"datasets":[{"meta":{"id":"O1709.002.1","entry":"O1709","subentry":"002","pointer":"1","code":"2-HE-3(A,G)4-BE-7,,SIG","sf":[["2-HE-3","A","G","4-BE-7","","SIG","","",""]],"complex":false,"reaction":"3He(a,g)","target":"3He","projectile":"a","process":"g","product":"4-BE-7","compound":"7Be","quantity":",SIG","quantity_class":"sigma","quantity_text":"","E_frame":"cm","E_source":"EN-CM","ang_frame":null,"value_frame":null,"value_unit":"b","cm_approx":false,"emin_cm":0.0929,"emax_cm":0.1695,"emin_lab":0.216201,"emax_lab":0.39447,"kt_min":null,"kt_max":null,"npts":6,"nexcluded":0,"final_levels":[],"level_heading":null,"err_components":[{"name":"ERR-1","kind":"sys","where":"common","unit":"PER-CENT","relative":true,"value":1.5,"text":".The error in beam intensity."},{"name":"ERR-2","kind":"sys","where":"common","unit":"PER-CENT","relative":true,"value":1.5,"text":".The error in He3 target density."},{"name":"ERR-3","kind":"stat","where":"common","unit":"PER-CENT","relative":true,"value":1.8,"text":".The error in Be-7 counting efficiency."},{"name":"ERR-4","kind":"sys","where":"common","unit":"PER-CENT","relative":true,"value":0.5,"text":".The error in incomplete Be-7 collection."},{"name":"ERR-5","kind":"sys","where":"common","unit":"PER-CENT","relative":true,"value":0.5,"text":".The error in Be-7 backscattering."},{"name":"ERR-6","kind":"sys","where":"common","unit":"PER-CENT","relative":true,"value":0.4,"text":".The error in Be-7 distribution in catcher."},{"name":"ERR-7","kind":"sys","where":"common","unit":"PER-CENT","relative":true,"value":0.4,"text":".The error in 478-keV gamma-ray branching."},{"name":"ERR-8","kind":"sys","where":"common","unit":"PER-CENT","relative":true,"value":0.1,"text":".The error in Be-7 half-life."},{"name":"ERR-9","kind":"sys","where":"common","unit":"PER-CENT","relative":true,"value":0.1,"text":". The error in parasitic Be-7 production."},{"name":"ERR-T","kind":"total","where":"point","unit":"NB","relative":false,"text":".Total uncertainty in data."},{"name":"ERR-S","kind":"stat","where":"point","unit":"NB","relative":false,"text":".The errors due to statistics-activity measurements."}],"d_tot_source":"ERR-T, else combined:ERR-3+ERR-S+ERR-1+ERR-2+ERR-4+ERR-5+ERR-6+ERR-7+ERR-8+ERR-9","err_columns":{"ERR-T":"err","ERR-S":"err"},"monitor":[],"flags":[],"flag_texts":{},"status":[{"code":"TABLE","ref":"","text":"Table 2 of NP/A,814,144,2008"}],"superseded_by":null,"history":[],"subentry_date":"2009-01-11","slices":["A"]},"points":{"E_lab":[0.216201,0.24599,0.294397,0.343736,0.393074,0.39447],"E_cm":[0.0929,0.1057,0.1265,0.1477,0.1689,0.1695],"value":[2.32e-10,5.46e-10,1.87e-09,4.61e-09,9.35e-09,1e-08],"d_stat":[4.176e-12,9.828e-12,5.228e-11,1.086e-10,2.538e-10,1.8e-10],"d_sys":[5.361e-12,1.262e-11,4.321e-11,1.065e-10,2.161e-10,2.311e-10],"d_tot":[1e-11,2.4e-11,6.783e-11,1.521e-10,3.333e-10,3.5e-10],"err":{"ERR-T":[1e-11,2.4e-11,null,null,null,3.5e-10],"ERR-S":[null,null,4e-11,7e-11,1.9e-10,null]}},"excluded":[]}]}